{
  "schemaVersion": 1,
  "action": "allow",
  "reason": "oriented against current generation",
  "reasonCode": "oriented",
  "receiptId": "xxh128:cafe01234567890abcdef01234567890abcdef01234567890abcdef01234567890",
  "candidateSet": {
    "id": "cs-1",
    "count": 1
  },
  "allowedScopes": ["repo"],
  "omissions": [],
  "nextAction": null,
  "evidence": null,
  "evidencePath": null,
  "receipt": null
}
